{
  "schemaVersion": "1",
  "repository": "taxkit",
  "purpose": "Public monorepo for the TaxKit tax engine, calculators, HTTP API, TypeScript SDK, and documentation runtime.",
  "lifecyclePhase": "maintained-harness-governance",
  "identitySource": "git rev-parse HEAD, git status --short --branch, and the content-addressed candidate manifest",
  "owners": {
    "docsRouter": "docs/README.md",
    "architecture": [
      "docs/architecture/README.md",
      "docs/architecture/"
    ],
    "standards": [
      "docs/standards/README.md",
      "docs/standards/"
    ],
    "readmes": [
      "README.md",
      "apps/**/README.md",
      "packages/**/README.md"
    ],
    "generatedReference": [
      "packages/api/http/src/openapi.ts",
      "packages/api/http/__snapshots__/openapi.json",
      "packages/docs-content/source.config.ts",
      "packages/docs-content/.source/"
    ],
    "runbooks": [
      "docs/runbooks/README.md",
      "docs/runbooks/"
    ],
    "proof": [
      "docs/verification/critical-journeys.json",
      "docs/verification/docs-deployment-journeys.json",
      "docs/evidence/deployments/",
      "docs/evidence/releases/"
    ],
    "evidence": [
      "docs/documentation-audit/",
      "docs/evidence/",
      "tools/evals/"
    ],
    "activeSpecs": [
      "docs/product-specs/index.md"
    ],
    "activePlans": [
      "docs/exec-plans/active/README.md"
    ],
    "archives": [
      "docs/exec-plans/completed/",
      "docs/documentation-audit/",
      "docs/evidence/"
    ],
    "skills": [
      "docs/skills.md",
      "docs/skill-profiles/"
    ],
    "agentGuidance": [
      "AGENTS.md",
      "CLAUDE.md"
    ]
  },
  "commands": {
    "documentation": [
      "bun run check:docs",
      "bun run check:runbooks",
      "bun run check:docs-deployment",
      "bun run check:repository-paths"
    ],
    "skills": [],
    "focused": [
      "bun run check:harness-governance:types",
      "bun run test:harness-governance",
      "bun run check:harness-governance",
      "bun run check:harness-foundation-epoch:types",
      "bun run check:harness-foundation-epoch"
    ],
    "closeout": [
      "bun run verification",
      "git diff --check"
    ]
  },
  "representativeJobs": [
    {
      "id": "TAXKIT-CALCULATOR",
      "consumer": "Direct calculator package consumer",
      "acceptedOutcome": "Schema-backed calculator operations return rule-owned results for canonical fixtures.",
      "owningPaths": [
        "packages/calculators/",
        "packages/rules/au/",
        "docs/verification/critical-journeys.json#taxkit-calculator-direct"
      ]
    },
    {
      "id": "TAXKIT-PACKED-SDK",
      "consumer": "Clean packed TypeScript SDK consumer",
      "acceptedOutcome": "The dist-only tarball installs and supported public entrypoints import without workspace source.",
      "owningPaths": [
        "packages/sdk/typescript/",
        "docs/verification/critical-journeys.json#taxkit-sdk-packed"
      ]
    },
    {
      "id": "TAXKIT-HTTP-API",
      "consumer": "Local HTTP API consumer",
      "acceptedOutcome": "Local health, metadata, calculation, schema-error, and OpenAPI responses match owning Schemas.",
      "owningPaths": [
        "apps/api/",
        "packages/api/http/",
        "docs/verification/critical-journeys.json#taxkit-http-api"
      ]
    },
    {
      "id": "TAXKIT-DOCS-RUNTIME",
      "consumer": "Local documentation-site reader",
      "acceptedOutcome": "The freshly built native API/Website renders accepted pages and proves private calls, navigation, search, discovery, Markdown, images, keyboard/focus/landmarks/contrast/reduced motion and safe recovery.",
      "owningPaths": [
        "apps/web/",
        "packages/docs-content/",
        "packages/docs-fumadocs/",
        "docs/verification/critical-journeys.json#taxkit-docs-runtime"
      ]
    },
    {
      "id": "TAXKIT-RELEASE-CLOSURE",
      "consumer": "TaxKit release maintainer",
      "acceptedOutcome": "The local report-only release-readiness graph completes nine checks with bounded evidence and no external mutation.",
      "owningPaths": [
        "packages/scripts/src/release-readiness/",
        "docs/verification/critical-journeys.json#taxkit-release-closure"
      ]
    },
    {
      "id": "TAXKIT-NATIVE-WEBSITE",
      "consumer": "Local Website reader and calculator user",
      "acceptedOutcome": "The native API and Website artifacts support private form and public browser calculations with checked settings, hydration, interruption and safe browser imports.",
      "owningPaths": [
        "apps/web/",
        "packages/api/rpc/",
        "docs/verification/critical-journeys.json#taxkit-native-website"
      ]
    }
  ],
  "criticalJourneyOwner": "docs/verification/critical-journeys.json",
  "boundaryFacts": [
    "Package, API, SDK, app, and public documentation behavior remains owned by code, Schemas, manifests, exports, and direct READMEs.",
    "The local release-readiness graph grants no versioning, Git, registry, release, deployment, provider, public-site, or recovery authority.",
    "The existing Quality workflow invokes bun run release:check -- --ci for pull requests and main-branch pushes; that graph begins with root verification and remains the sole hosted CI route.",
    "Exactly five operational runbooks and docs/operations/authority-model.md remain the repeatable operation and authority owners.",
    "The current six local journeys include the native Website. The separate four-entry docs deployment journey owner and dated deployment receipts grant no additional authority; historical five-journey HGI/HFI evidence remains unchanged.",
    "Repository validators work from a clean clone. Agents separately look up the latest plugin through docs/skills.md.",
    "Current docs-browser release checking and Quality Playwright bootstrap select apps/web. The old apps/docs workspace and writers are retired with verified retained sources; new provider operations remain T010 work; no historical packet or provider target is reinterpreted."
  ],
  "exclusions": [
    "Dependency, build, cache, generated route, temporary, binary, and vendored trees are excluded from readable corpus accounting.",
    "Website design, public MDX copy, navigation and package/API/SDK behavior are outside this profile/runbook migration; provider mutation remains limited to the separately authorized TaxKit docs deployment receipts.",
    "HGI-203 through HGI-206 evidence is preserved and not rewritten."
  ],
  "nonClaims": [
    "Repository-local validation does not establish hosted CI success.",
    "Local Git commits do not establish push, remote branch, tag, or release state.",
    "The DCD-002 requalification chain establishes one dated Preview deployment/hosted/teardown observation; it establishes no current Preview availability, Production, rollback, public-domain behavior, release or publication.",
    "A target-specific harness epoch does not establish general causal effectiveness for other workers, repositories, or future skill states.",
    "Local checks do not establish remote Git, registry, release, deployment, provider, public-site or external-consumer state."
  ],
  "exceptions": []
}
